{
  "checks": [
    {
      "check_id": "policy.adversarial_scan",
      "message": "fixture",
      "passed": true
    }
  ],
  "generated_at": "1970-01-01T00:00:00Z",
  "run_id": "r-pass-tier1",
  "schema_version": "1.0.0",
  "summary": {
    "failed": 0,
    "passed": 1,
    "total_checks": 1
  }
}
